{
  "schema_version": 3,
  "id": "grassland",
  "appearance": {
    "presentation": {
      "kind": "cube",
      "material": "organic",
      "tile_span": 4,
      "faces": {
        "top": "top.png",
        "side": "side.png",
        "bottom": "side.png"
      }
    }
  },
  "display": {
    "name": "草地",
    "description": "平原地表，只用于场景。",
    "icon": "icon.png"
  }
}
