{"schema_version":3,"id":"clothing","appearance":{"allowed_orientations":"four_way","presentation":{"kind":"cube","material":"organic","faces":{"top":"shared/organic-face.png","side":"shared/organic-face.png","bottom":"shared/organic-face.png"}}},"display":{"name":"衣物","description":"衣物的第一版正式定义；数值待配平，占位贴图待美术制作。","icon":"shared/organic-icon.png"},"simulation":{"value":46,"mass":0.8,"max_durability":180,"tags":[]}}
