{
  "schema_version": 3,
  "id": "consumer-electronics",
  "simulation": {
    "value": 100,
    "mass": 0.1,
    "max_durability": 100
  },
  "appearance": {
    "presentation": {
      "kind": "cube",
      "material": "organic",
      "faces": {
        "top": "shared/vehicle-underside.png",
        "side": "shared/vehicle-underside.png",
        "bottom": "shared/vehicle-underside.png"
      }
    }
  },
  "display": {
    "name": "消费电子",
    "description": "人口规则格式示例使用的生活货物，数值和贴图仅为占位。",
    "icon": "shared/vehicle-underside.png"
  }
}
