{
  "schema_version": 3,
  "id": "foliage",
  "appearance": {
    "presentation": {
      "kind": "cube",
      "material": "organic",
      "faces": { "top": "top.png", "side": "side.png", "bottom": "side.png" }
    }
  },
  "display": { "name": "树冠", "description": "树木的枝叶，只用于场景。", "icon": "icon.png" }
}
