{"schema_version":3,"id":"bogie","appearance":{"allowed_orientations":"four_way","presentation":{"kind":"mesh","model":"model.glb","surface_materials":["bare_metal"]},"behaviors":{"wheelset":{}}},"display":{"name":"转向架","description":"转向架的正式美术；数值待配平，画面待用户阶段试玩确认。","icon":"icon.png"},"simulation":{"value":85,"mass":0.034,"max_durability":240,"tags":[]}}
