{"schema_version":3,"id":"creature-tissue","appearance":{"allowed_orientations":"four_way","presentation":{"kind":"cube","material":"organic","faces":{"top":"top.png","side":"side.png","bottom":"top.png"},"tile_span":1}},"display":{"name":"软组织","description":"暗红色纤维组织，表面有弯曲的组织带和细褶。","icon":"icon.png"}}
