{"schema_version":3,"id":"cannon","appearance":{"allowed_orientations":"four_way","presentation":{"kind":"mesh","model":"model.glb","surface_materials":["painted_metal","bare_metal"]}},"display":{"name":"火炮","description":"火炮的第三阶段模型样稿；数值待配平，画面待用户阶段试玩确认。","icon":"shared/equipment-icon.png"},"simulation":{"value":145,"mass":1.12,"max_durability":180,"tags":[],"behaviors":{"weapon":{"damage":72,"interval":4}}}}
